{
  "account_hint": "华辰装备有限公司",
  "owner": "销售负责人",
  "analysis_goal": "生成客户画像、商机摘要、商机评分、风险和下一步建议",
  "materials": [
    {
      "type": "meeting_note",
      "name": "2026-07-05客户拜访记录",
      "content": "客户：华辰装备有限公司，江苏苏州，装备制造企业。张伟 采购总监参加会议。客户计划在Q3前完成质检自动化升级，现场人工质检效率低，检测数据无法统一沉淀，质量问题追溯困难。客户已有年度技改预算，但预算金额未明确。现有系统包括ERP和MES，希望后续方案能够和MES集成。客户希望先安排技术交流，再决定是否进入报价。",
      "confidence": 0.91
    },
    {
      "type": "email",
      "name": "张伟邮件反馈",
      "content": "张总反馈：可以先做技术交流，请准备一页式方案，重点说明检测点位、数据采集、与MES接口以及交付周期。",
      "confidence": 0.88
    }
  ]
}